Sheet: 考勤统计
A1: 北京掌上明珠科技股份有限公司
A2: 2015年10月明珠股份考勤汇总表
A3: 部门 | B3: 序号 | C3: 人员编码 | D3: 姓名 | E3: 迟到次数 | F3: 早退次数 | G3: 漏打卡次数 | H3: 扣款金额 | I3: 倒休/特批 | J3: 15年 剩余倒休 | K3: 年假 | L3: 15年 剩余年假 | M3: 14年 剩余年假 | N3: 病假 | O3: 带薪病假 | P3: 15年剩余 带薪病假 | Q3: 事假 | R3: 旷工 | S3: 其他 | T3: 出勤天数 | U3: 倒休 | V3: 出差天数 | W3: 餐补天数 | X3: 转正前出勤天数 | Y3: 转正后出勤天数（天） | Z3: 备注
A4: 社区部 | B4: 1 | C4: 00072 | D4: 刘泉美 | E4: 1 | F4: 0 | G4: 0 | H4: =(+RC[-1])*20 -> 0 | I4: 1 | K4: 3 | M4: 0 | N4: 0 | O4: 0 | Q4: 0 | R4: 0 | S4: 0 | T4: =21.75-RC[-3]-RC[-6] -> 21.75 | U4: =IF(RC[-12]/8<0.5,0,IF(RC[-12]/8>=0.5,RC[-12]/8)) -> 0 | W4: =IF(RC[1]="",ROUND(RC[-3]-RC[-2]-RC[-12]-RC[-8]-RC[-4]-RC[-1],0),0) -> 19
B5: 2 | C5: 00047 | D5: 毕博 | E5: 0 | F5: 0 | G5: 0 | H5: =(RC[-3]+RC[-2]+RC[-1])*20 -> 0 | I5: 0 | K5: 0 | M5: 0 | N5: 0 | O5: 0 | Q5: 0 | R5: 0 | S5: 0 | T5: =21.75-RC[-3]-RC[-6] -> 21.75 | U5: =IF(RC[-12]/8<0.5,0,IF(RC[-12]/8>=0.5,RC[-12]/8)) -> 0 | W5: =IF(RC[1]="",ROUND(RC[-3]-RC[-2]-RC[-12]-RC[-8]-RC[-4]-RC[-1],0),0) -> 22
B6: 3 | C6: 00048 | D6: 曹雷 | E6: 0 | F6: 0 | G6: 0 | H6: =(RC[-3]+RC[-2]+RC[-1])*20 -> 0 | I6: 0 | K6: 0 | M6: 0 | N6: 0 | O6: 0 | Q6: 0 | R6: 0 | S6: 0 | T6: =21.75-RC[-3]-RC[-6] -> 21.75 | U6: =IF(RC[-12]/8<0.5,0,IF(RC[-12]/8>=0.5,RC[-12]/8)) -> 0 | W6: =IF(RC[1]="",ROUND(RC[-3]-RC[-2]-RC[-12]-RC[-8]-RC[-4]-RC[-1],0),0) -> 22
B7: 4 | C7: 00123 | D7: 石东轩 | E7: 1 | F7: 0 | G7: 0 | H7: =(RC[-3]+RC[-2]+RC[-1])*20 -> 20 | I7: 0 | K7: 0 | M7: 0 | N7: 0 | O7: 0 | Q7: 1.5 | R7: 0 | S7: 0 | T7: =21.75-RC[-3]-RC[-6] -> 20.25 | U7: =IF(RC[-12]/8<0.5,0,IF(RC[-12]/8>=0.5,RC[-12]/8)) -> 0 | W7: =IF(RC[1]="",ROUND(RC[-3]-RC[-2]-RC[-12]-RC[-8]-RC[-4]-RC[-1],0),0) -> 20
B8: 5 | C8: 00475 | D8: 刘唱 | E8: 0 | F8: 0 | G8: 0 | H8: =(RC[-3]+RC[-2]+RC[-1])*20 -> 0 | I8: 0 | K8: 0 | M8: 0 | N8: 1 | O8: 0 | Q8: 0 | R8: 0 | S8: 0 | T8: =21.75-RC[-3]-RC[-6] -> 20.75 | U8: =IF(RC[-12]/8<0.5,0,IF(RC[-12]/8>=0.5,RC[-12]/8)) -> 0 | W8: =IF(RC[1]="",ROUND(RC[-3]-RC[-2]-RC[-12]-RC[-8]-RC[-4]-RC[-1],0),0) -> 0 | X8: =RC[-4] -> 20.75
A9: 标注此颜色为离职员工
A10: 标注此颜色为试用期员工 | I10: 注：人事部有权根据公司制度对考勤系统数据进行复核，以保证考勤制度的公平性
A11: 标注此颜色为实习生
A12: 标注此颜色为残疾人
A13: 标注此为按自然天计算的特殊假期，计算餐补时应按工作日天数计算
A15: 制表： | H15: 审核：
A16: 日期： | H16: 日期：
A18: 部门负责人： | H18: 人事总监:
A19: 日期： | H19: 日期：